{
  "SchemaVersion": "1.0",
  "ToolVersion": "3.0.0",
  "HandEdited": false,
  "Source": {
    "Path": "Invoke-AmdNpuDriverResearch.ps1",
    "Sha256": "d2ab9b75959ced038e20c64d2ce14b3d61be8bc9a59c28aa99df2544522591cd"
  },
  "GeneratedFiles": [
    {
      "Path": "catalog/driver-compatibility-matrix.json",
      "Length": 1005091,
      "Sha256": "c20a93d8245a276260b1ce35cae35a34f7ae982a1489f5306d0da8360641d2d2"
    },
    {
      "Path": "catalog/driver-compatibility-matrix.md",
      "Length": 84493,
      "Sha256": "ec28bb2376e88fbe3e95571b020fdc08f32e76045a94def036640e17008dd3bf"
    },
    {
      "Path": "catalog/hardware-identities.json",
      "Length": 7576,
      "Sha256": "ffed34c73f4414894241a8c4c66d16ebbfb3d2bd23006dbcccb25f7e3455380d"
    },
    {
      "Path": "catalog/hardware-identities.md",
      "Length": 1164,
      "Sha256": "d35b14926e14c62e89459865e795466b91d4cc1a778839c23c15384aaa4e8e4b"
    },
    {
      "Path": "catalog/observed-runtime-evidence.json",
      "Length": 3751,
      "Sha256": "b2c52400e814b3385a8b858377a21c6df13e6ccffc3a1faf4d7b00f0c2689d61"
    },
    {
      "Path": "catalog/observed-runtime-evidence.md",
      "Length": 569,
      "Sha256": "16ac3bd14feeb346a8477a6ea66a9d470c49a30bf5c9e0d07190255076d59e7d"
    },
    {
      "Path": "catalog/processor-catalog.json",
      "Length": 95120,
      "Sha256": "df176eadd05601af3355ffee2ce85e6a3b529c83c748180fef18602ce90129cf"
    },
    {
      "Path": "catalog/processor-catalog.md",
      "Length": 15494,
      "Sha256": "4fff280d5d9bc57057c0e9bcb916595d66c8f020b61e724bc89963e6096d946d"
    },
    {
      "Path": "catalog/processor-driver-applicability.json",
      "Length": 483415,
      "Sha256": "07adcc7916a055404ebe5ce19f8dc24d73ceb6c965ca56f337b4d356ee72311d"
    },
    {
      "Path": "catalog/processor-driver-applicability.md",
      "Length": 34383,
      "Sha256": "1872cfb5e0d382864f0cacc6206f00c3fba18499e21b4eb7780d0caf4c0e2584"
    },
    {
      "Path": "comparisons/NPU_RAI1.5_280_WHQL--vs--NPU_RAI_280_WHQL.json",
      "Length": 9677,
      "Sha256": "e75fbe276a2094f10ccaf8ff82d3769f96212b574d018b88f5007ae4b219132e"
    },
    {
      "Path": "comparisons/NPU_RAI1.5_280_WHQL--vs--NPU_RAI_280_WHQL.md",
      "Length": 706,
      "Sha256": "e0fdb97d24103ee3aa77b178480d4ba0ad8391a0696440b7f24074705d62b002"
    },
    {
      "Path": "comparisons/NPU_RAI1.5_280_WHQL--vs--NPU_RAI_376_WHQL.json",
      "Length": 22130,
      "Sha256": "a466630e17fae0f4ca91982cf4edc1a425055dbdd6fc9558fdab9b4ec5697dbc"
    },
    {
      "Path": "comparisons/NPU_RAI1.5_280_WHQL--vs--NPU_RAI_376_WHQL.md",
      "Length": 3665,
      "Sha256": "76a12d627db44cc887d6e12173bae5326d5b95b4c531115343724fc5fa11007f"
    },
    {
      "Path": "comparisons/NPU_RAI_280_WHQL--vs--NPU_RAI_376_WHQL.json",
      "Length": 21855,
      "Sha256": "be1d08831b6d02fe84a31abdebcc031f36e45c75b17c9270eb74f22d3e6ca854"
    },
    {
      "Path": "comparisons/NPU_RAI_280_WHQL--vs--NPU_RAI_376_WHQL.md",
      "Length": 3589,
      "Sha256": "d356236480f516a7604d3698b354d2239fc622e2179f21a8fdb34ddbc24a72b0"
    },
    {
      "Path": "releases/NPU_RAI1.5_280_WHQL.json",
      "Length": 41899,
      "Sha256": "383355f05c8be0cde30ad533f2c8800f4e59056d08f04324530f3ef999fe1bba"
    },
    {
      "Path": "releases/NPU_RAI1.5_280_WHQL.md",
      "Length": 3518,
      "Sha256": "8e5e3bbbf819b8b89710109f40d6fa15dae630f8e03c0455daf81254b2032c03"
    },
    {
      "Path": "releases/NPU_RAI_280_WHQL.json",
      "Length": 42063,
      "Sha256": "75a2931120a67dd1bbadc48bf26b1939d531860c5a2227c935a7234f1851061e"
    },
    {
      "Path": "releases/NPU_RAI_280_WHQL.md",
      "Length": 3499,
      "Sha256": "cae3bb90efa7e18d81a45991e5fc31eac9d331f168ac66942c6ec612a63f82c9"
    },
    {
      "Path": "releases/NPU_RAI_376_WHQL.json",
      "Length": 37819,
      "Sha256": "75559d696ca6f25dcc1fa550d11a84a7f8cbd5a8d152c5b3bc71d8addfad119c"
    },
    {
      "Path": "releases/NPU_RAI_376_WHQL.md",
      "Length": 4026,
      "Sha256": "a25f0fa486ac7fa657c00e5508241241bc21243cce23273f1bab90c342bb57b6"
    }
  ]
}
